{
  "schemaVersion": "country_security_catalog_v1",
  "catalogVersion": "2026-10-08.3",
  "reviewedOn": "2026-10-08",
  "controlAreas": [
    {
      "id": "system_classification",
      "label": "Phân loại hệ thống và căn cứ áp dụng",
      "evidenceKinds": [
        "policy_document",
        "independent_review"
      ]
    },
    {
      "id": "risk_management",
      "label": "Quản trị và quản lý rủi ro",
      "evidenceKinds": [
        "policy_document",
        "independent_review"
      ]
    },
    {
      "id": "identity_access",
      "label": "Danh tính, xác thực và kiểm soát truy cập",
      "evidenceKinds": [
        "configuration",
        "independent_review",
        "scan_metadata"
      ]
    },
    {
      "id": "secure_configuration",
      "label": "Cấu hình an toàn",
      "evidenceKinds": [
        "configuration",
        "independent_review",
        "scan_metadata"
      ]
    },
    {
      "id": "network_protection",
      "label": "Bảo vệ mạng và phân vùng",
      "evidenceKinds": [
        "configuration",
        "independent_review",
        "scan_metadata"
      ]
    },
    {
      "id": "patch_management",
      "label": "Quản lý cập nhật và lỗ hổng",
      "evidenceKinds": [
        "configuration",
        "policy_document",
        "independent_review",
        "scan_metadata"
      ]
    },
    {
      "id": "malware_protection",
      "label": "Phòng chống mã độc",
      "evidenceKinds": [
        "configuration",
        "independent_review"
      ]
    },
    {
      "id": "application_security",
      "label": "An toàn ứng dụng và kiểm tra đầu vào",
      "evidenceKinds": [
        "configuration",
        "independent_review",
        "scan_metadata"
      ]
    },
    {
      "id": "data_protection",
      "label": "Bảo vệ dữ liệu",
      "evidenceKinds": [
        "configuration",
        "policy_document",
        "independent_review"
      ]
    },
    {
      "id": "logging_monitoring",
      "label": "Ghi nhật ký và giám sát",
      "evidenceKinds": [
        "configuration",
        "policy_document",
        "independent_review"
      ]
    },
    {
      "id": "incident_response",
      "label": "Ứng cứu sự cố",
      "evidenceKinds": [
        "policy_document",
        "independent_review"
      ]
    },
    {
      "id": "backup_recovery",
      "label": "Sao lưu và khôi phục",
      "evidenceKinds": [
        "configuration",
        "policy_document",
        "independent_review"
      ]
    },
    {
      "id": "assurance_review",
      "label": "Thẩm định và đánh giá độc lập",
      "evidenceKinds": [
        "policy_document",
        "independent_review"
      ]
    },
    {
      "id": "staff_awareness",
      "label": "Nhận thức và trách nhiệm nhân sự",
      "evidenceKinds": [
        "policy_document",
        "independent_review"
      ]
    },
    {
      "id": "supplier_security",
      "label": "An toàn nhà cung cấp",
      "evidenceKinds": [
        "policy_document",
        "independent_review"
      ]
    },
    {
      "id": "application_control",
      "label": "Essential Eight: kiểm soát ứng dụng",
      "evidenceKinds": [
        "configuration",
        "independent_review"
      ]
    },
    {
      "id": "patch_applications",
      "label": "Essential Eight: cập nhật ứng dụng",
      "evidenceKinds": [
        "configuration",
        "independent_review"
      ]
    },
    {
      "id": "restrict_macros",
      "label": "Essential Eight: hạn chế macro Microsoft Office",
      "evidenceKinds": [
        "configuration",
        "independent_review"
      ]
    },
    {
      "id": "user_application_hardening",
      "label": "Essential Eight: tăng cường an toàn ứng dụng người dùng",
      "evidenceKinds": [
        "configuration",
        "independent_review"
      ]
    },
    {
      "id": "restrict_admin_privileges",
      "label": "Essential Eight: hạn chế quyền quản trị",
      "evidenceKinds": [
        "configuration",
        "independent_review"
      ]
    },
    {
      "id": "patch_operating_systems",
      "label": "Essential Eight: cập nhật hệ điều hành",
      "evidenceKinds": [
        "configuration",
        "independent_review"
      ]
    },
    {
      "id": "multi_factor_authentication",
      "label": "Essential Eight: xác thực đa yếu tố",
      "evidenceKinds": [
        "configuration",
        "independent_review"
      ]
    },
    {
      "id": "regular_backups",
      "label": "Essential Eight: sao lưu thường xuyên",
      "evidenceKinds": [
        "configuration",
        "independent_review"
      ]
    },
    {
      "id": "physical_security",
      "label": "Physical protection of facilities and equipment",
      "evidenceKinds": [
        "configuration",
        "policy_document",
        "independent_review"
      ]
    }
  ],
  "frameworks": [
    {
      "id": "vn-system-levels",
      "countryCode": "VN",
      "countryName": "Việt Nam",
      "label": "Cấp độ bảo vệ hệ thống thông tin",
      "version": "Luật 116/2025/QH15; Nghị định 331/2026/NĐ-CP",
      "kind": "impact_classification",
      "ordinalLevels": true,
      "currency": "reviewed_reference",
      "applicability": "Hệ thống thông tin thuộc phạm vi pháp luật Việt Nam; chủ quản xác định tiêu chí và hồ sơ áp dụng. Mức tác động không thể suy ra từ số finding của một website.",
      "levelSelection": "owner_or_authority",
      "levels": [
        {
          "id": "level-1",
          "label": "Cấp độ 1",
          "summary": "Hậu quả đối với quyền, lợi ích hợp pháp của tổ chức hoặc cá nhân; cần đối chiếu đầy đủ tiêu chí trong văn bản."
        },
        {
          "id": "level-2",
          "label": "Cấp độ 2",
          "summary": "Hậu quả nghiêm trọng đối với quyền, lợi ích hợp pháp hoặc hậu quả đối với lợi ích công cộng."
        },
        {
          "id": "level-3",
          "label": "Cấp độ 3",
          "summary": "Hậu quả đặc biệt nghiêm trọng đối với quyền, lợi ích của tổ chức/cá nhân; nghiêm trọng đối với lợi ích công cộng; tổn hại hoặc tổn hại nghiêm trọng tới trật tự, an toàn xã hội hoặc tổn hại tới an ninh quốc gia."
        },
        {
          "id": "level-4",
          "label": "Cấp độ 4",
          "summary": "Hậu quả đặc biệt nghiêm trọng đối với lợi ích công cộng, trật tự và an toàn xã hội hoặc nghiêm trọng đối với an ninh quốc gia."
        },
        {
          "id": "level-5",
          "label": "Cấp độ 5",
          "summary": "Hậu quả đặc biệt nghiêm trọng đối với an ninh quốc gia."
        }
      ],
      "controlIds": [
        "system_classification",
        "risk_management",
        "identity_access",
        "secure_configuration",
        "network_protection",
        "patch_management",
        "application_security",
        "data_protection",
        "logging_monitoring",
        "incident_response",
        "backup_recovery",
        "assurance_review"
      ],
      "mappingCoverage": "partial",
      "sources": [
        {
          "id": "vn-law-116",
          "title": "Luật An ninh mạng 116/2025/QH15",
          "url": "https://congbao.chinhphu.vn/van-ban/luat-so-116-2025-qh15-468678/61574.htm",
          "locator": "Điều 8, 44–45; hiệu lực 01/07/2026"
        },
        {
          "id": "vn-decree-331",
          "title": "Nghị định 331/2026/NĐ-CP",
          "url": "https://congbao.chinhphu.vn/van-ban/nghi-dinh-so-331-2026-nd-cp-470334.htm",
          "locator": "Điều 8, 11–15, 38–39; hiệu lực 19/08/2026"
        },
        {
          "id": "vn-decree-85-transition",
          "title": "Nghị định 85/2016/NĐ-CP: tham chiếu chuyển tiếp",
          "url": "https://vbpl.vn/TW/Pages/ivbpq-thuoctinh.aspx?ItemID=112057",
          "locator": "Đối chiếu với Điều 39 Nghị định 331/2026; không dùng làm căn cứ duy nhất"
        },
        {
          "id": "vn-tcvn-14423-2026",
          "title": "TCVN 14423:2026, danh mục VSQI; chưa tiếp cận toàn văn",
          "url": "https://tieuchuan.vsqi.gov.vn/tieuchuan/view?sohieu=TCVN+14423%3A2026",
          "locator": "QĐ 3243/QĐ-BKHCN 24/07/2026; thay TCVN 14423:2025 và TCVN 11930:2017; chỉ xác minh metadata"
        }
      ],
      "limitations": [
        "Tóm tắt cấp độ là diễn giải ngắn, không thay thế toàn văn và hồ sơ thẩm định/phê duyệt.",
        "Phải xét tiêu chí chi tiết và chọn cấp độ cao nhất phù hợp; có yêu cầu chuyển tiếp cho hệ thống đã phê duyệt hoặc đang đầu tư trước 01/07/2026.",
        "Catalog giữ các nguồn đã đối chiếu cho cấp độ; cần kiểm tra văn bản sửa đổi và quy định ngành khi xác định nghĩa vụ thực tế.",
        "Nhóm kiểm tra trong harness chỉ là chủ đề rà soát của OpenHunter, chưa mã hóa đầy đủ mọi yêu cầu theo từng cấp độ.",
        "Pack điều khoản tuyển chọn nằm riêng tại packs/vn-system-levels.requirements.json. Chưa đọc toàn văn TCVN 14423:2026; không coi các tiểu mục kỹ thuật đã được ánh xạ đầy đủ."
      ]
    },
    {
      "id": "cn-mlps",
      "countryCode": "CN",
      "countryName": "Trung Quốc",
      "label": "Multi-Level Protection Scheme (MLPS)",
      "version": "GB/T 22240-2020; GB/T 22239-2019",
      "kind": "impact_classification",
      "ordinalLevels": true,
      "currency": "reviewed_reference",
      "applicability": "Đối tượng thuộc MLPS tại Trung Quốc; phạm vi quản lý, đăng ký và đánh giá cần người phụ trách xác định.",
      "levelSelection": "owner_or_authority",
      "levels": [
        {
          "id": "level-1",
          "label": "Level 1",
          "summary": "Tác động đến quyền, lợi ích hợp pháp; không gây tác động đến an ninh quốc gia, trật tự xã hội hoặc lợi ích công cộng."
        },
        {
          "id": "level-2",
          "label": "Level 2",